{
  "eventId": "e0000000-0000-4000-8000-000000000004",
  "eventType": "analysis.reviewed",
  "schemaVersion": "0.2",
  "occurredAt": "2026-10-08T04:00:00Z",
  "tenantId": "7a000000-0000-4000-8000-000000000001",
  "correlationId": "c0ffee00-0000-4000-8000-0000000000aa",
  "analysisId": "3f6c1d52-8a41-4c5e-9b0a-6d2f7a1e0001",
  "data": {
    "patientId": "9b2e5c10-1111-4a2b-8c3d-000000000001",
    "isApproved": false,
    "version": 1
  }
}